Cotton Shirt with Patch Pocket , ₹450 , NETPLAY , D2C Fashion
Tapered Fit Flat-Front Trousers , ₹768 , NETPLAY , D2C Fashion
Cuban Collar Shirt with Short Sleeves , ₹480 , WUXI , D2C Fashion
Men Knitted Loose Fit Shirt with Mandarin Collar , ₹480 , WUXI , D2C Fashion
Spread Collar Shirt with Patch Pocket , ₹440 , Bombay Begum , D2C Fashion
Straight Fit Flat-Front Pants , ₹1349 , SNITCH , D2C Fashion
Checked Shirt with Patch Pocket , ₹720 , Campus Sutra , D2C Fashion
Men Floral Print Slim Fit Shirt , ₹909 , NETPLAY , D2C Fashion
Flat-Front Trousers with Insert Pockets , ₹912 , NETPLAY , D2C Fashion
Men Loose Fit Band-Collar Shirt with Drop-Shoulder Sleeves , ₹480 , WUXI , D2C Fashion
Men Bedford Dobby Slim Fit Shirt with Patch Pocket , ₹500 , NETPLAY , D2C Fashion
Verdant Slim Fit Shirt , ₹1499 , SNITCH , D2C Fashion
Slim Fit Flat-Front Trousers , ₹882 , JOHN PLAYERS , D2C Fashion
Slim Fit Flat-Front Trousers , ₹735 , JOHN PLAYERS , D2C Fashion
Striped Slim Fit Shirt , ₹675 , DENNISLINGO PREMIUM ATTIRE , D2C Fashion
Camouflage Print Slim Fit Jogger Pants , ₹624 , DNMX , D2C Fashion
Men Slim Fit Checked Shirt , ₹1248 , THE BEAR HOUSE , D2C Fashion
Trailsman Flannel Shirt , ₹3599 , SUPERDRY , D2C Fashion
Cotton Shirt with Flap Pockets , ₹980 , Lee Cooper , D2C Fashion
Flat-Front Tapered Fit Trousers , ₹912 , NETPLAY , D2C Fashion
Men Checked Slim Fit Shirt with Patch Pocket , ₹882 , JOHN PLAYERS , D2C Fashion
Flat-Front Tapered Fit Trousers , ₹768 , NETPLAY , D2C Fashion
Men Regular Fit Shirt with Short Sleeves , ₹440 , Bombay Begum , D2C Fashion
D810PBRI Water Resistant Analogue Wrist Watch , ₹18900 , Mathey- Tissot , D2C Fashion
Men Checked Regular Fit Shirt with Spread Collar , ₹504 , Silverfly , D2C Fashion
Striped Shirt with Spread Collar , ₹750 , Campus Sutra , D2C Fashion
Slim Fit Flat-Front Trousers , ₹720 , NETPLAY , D2C Fashion
Men Knitted Loose Fit Shirt , ₹480 , WUXI , D2C Fashion
Cuban Collar Shirt with Short Sleeves , ₹480 , WUXI , D2C Fashion
Studios Slim Fit Chinos , ₹3599 , SUPERDRY , D2C Fashion
Men Micro Printed Slim Fit Shirt , ₹624 , NETPLAY , D2C Fashion
Men Striped Slim Fit Shirt with Patch Pocket , ₹726 , The Indian Garage Co , D2C Fashion
Men Textured Loose Fit Shirt , ₹480 , WUXI , D2C Fashion
Men Knitted Loose Fit Shirt with Mandarin Collar , ₹480 , WUXI , D2C Fashion
Men Checked Slim Fit Shirt with Patch Pocket , ₹735 , JOHN PLAYERS , D2C Fashion
H810BBU Analogue Watch with Metal Strap , ₹14025 , Mathey- Tissot , D2C Fashion
Women Relaxed Fit Pants with Elasticated Waist , ₹320 , Silverfly , D2C Fashion
Striped Slim Fit Shirt with Band-Collar , ₹624 , NETPLAY , D2C Fashion
Cotton Shirt with Patch Pocket , ₹700 , DILLINGER , D2C Fashion
Slim Fit Ankle Length Flat-Front Trousers , ₹882 , JOHN PLAYERS , D2C Fashion
High-Rise Straight Fit Trousers , ₹360 , KOTTY , D2C Fashion
Vintage Heritage Check Relaxed Fit Shirt , ₹2999 , SUPERDRY , D2C Fashion
Men Micro Printed Slim Fit Shirt , ₹624 , NETPLAY , D2C Fashion
Tapered Fit Flat-Front Chinos , ₹912 , NETPLAY , D2C Fashion
Men Floral Printed Slim Fit Shirt , ₹898 , THE BEAR HOUSE , D2C Fashion
